{
  "Subject": "One person at a cafe table, physically neutral unless separate identity images are supplied. Do not derive hair, skin tone or face from a scene reference.",
  "Clothing": "A plain dark overshirt over a neutral cotton top, with relaxed drape and visible seam structure.",
  "Pose": "Seated with one hand resting on an open notebook and the other near a ceramic cup, face directed toward the camera.",
  "Setting": "A casual cafe interior with a wooden table beside a large window.",
  "Camera Settings": "Horizontal medium portrait at eye level, moderate depth of field that preserves the table and window context.",
  "Lighting": "Soft side daylight from camera-left and modest warm background practicals, with coherent contact shadows.",
  "Effects": "Restrained colour treatment and gentle background softness, no dramatic glow.",
  "Background": "Muted tables and wall surfaces spatially behind the subject, without unrelated landmarks.",
  "Details": "Maintain cup and notebook scale and hand placement; no added logo or overlay text.",
  "Quality": "Natural fabric, ceramic and wood response, plausible proportions and photographic realism."
}
